{
  "$schema": "https://json-schema.org/draft/2020-12/schema",
  "$id": "https://schemas.inneranimalmedia.com/agentsam/skills/agentsam.skill.v1.schema.json",
  "title": "AgentSamSkillManifest",
  "description": "Portable AgentSam skill definition. Identity is package/local id — not workspace, tenant, R2 key, or default model.",
  "type": "object",
  "required": ["schema", "id", "name", "instructions"],
  "additionalProperties": false,
  "properties": {
    "schema": { "const": "agentsam.skill.v1" },
    "id": {
      "type": "string",
      "pattern": "^[a-z0-9][a-z0-9-]{0,63}$"
    },
    "name": { "type": "string", "minLength": 1 },
    "description": { "type": "string" },
    "icon": {
      "type": "string",
      "description": "Semantic agentsam.icon.v1 key only"
    },
    "version": { "type": "string" },
    "package": { "type": "string" },
    "slash": {
      "type": "object",
      "additionalProperties": false,
      "properties": {
        "suggested": {
          "type": "string",
          "pattern": "^/[a-z0-9][a-z0-9-]{0,63}$",
          "description": "Suggested trigger at install time. Not globally reserved."
        }
      }
    },
    "instructions": {
      "type": "object",
      "required": ["source"],
      "additionalProperties": false,
      "properties": {
        "source": {
          "enum": ["inline", "local_file", "package_file", "database", "object_store"]
        },
        "ref": { "type": "string" },
        "inline": { "type": "string" }
      }
    },
    "execution": {
      "type": "object",
      "additionalProperties": false,
      "properties": {
        "mode": { "const": "turn" },
        "tools": { "type": "array", "items": { "type": "string" } },
        "operations": { "type": "array", "items": { "type": "string" } },
        "capabilities": { "type": "array", "items": { "type": "string" } }
      }
    }
  }
}
