{
  "schema": "agentsam.skill.v1",
  "id": "agentsam-arch-specifications",
  "name": "Construction specifications",
  "description": "Use classification and verified manufacturer source data instead of model guesses",
  "version": "0.1.0",
  "slash": {
    "suggested": "/arch-specifications"
  },
  "instructions": {
    "source": "local_file",
    "ref": "SKILL.md"
  },
  "execution": {
    "mode": "turn",
    "tools": [],
    "operations": [],
    "capabilities": []
  }
}
