{
  "schema": "agentsam.skill.v1",
  "id": "agentsam-arch-documents",
  "name": "Architectural sheets and construction documents",
  "description": "Produce coordinated SD/DD/CD sheets and artifact evidence",
  "version": "0.1.0",
  "slash": {
    "suggested": "/arch-documents"
  },
  "instructions": {
    "source": "local_file",
    "ref": "SKILL.md"
  },
  "execution": {
    "mode": "turn",
    "tools": [],
    "operations": [],
    "capabilities": []
  }
}
