{
  "schema": "agentsam.skill.v1",
  "id": "agentsam-arch-materials",
  "name": "Nominal and actual building materials",
  "description": "Look up real product sizes and distinguish dimensions from trade names",
  "version": "0.1.0",
  "slash": {
    "suggested": "/arch-materials"
  },
  "instructions": {
    "source": "local_file",
    "ref": "SKILL.md"
  },
  "execution": {
    "mode": "turn",
    "tools": [],
    "operations": [],
    "capabilities": []
  }
}
